{
  "profile": {
    "claims": [
      "VizAI is an AI software platform for collecting, verifying, and organizing business facts into registry-ready profiles and export packages."
    ],
    "services": [
      "Business fact intake and verification",
      "Registry-ready business profile generation",
      "Business intelligence and visibility reporting"
    ],
    "locations": [
      {
        "name": "Ontario, Canada"
      }
    ],
    "businessType": "AI software / business intelligence platform",
    "industriesServed": [
      "Business operations",
      "Business intelligence"
    ]
  },
  "category": "technology",
  "metadata": {
    "dateAdded": "2026-06-27",
    "lastUpdated": "2026-06-27"
  },
  "entitySlug": "vizai",
  "verification": {
    "tier": "claimed_verified",
    "method": "customer-canon-approval",
    "status": "claimed_verified",
    "canonVersion": "3.0",
    "lastVerified": "2026-06-27"
  },
  "schemaVersion": "1.0",
  "profileVersion": 1,
  "businessIdentifier": {
    "legalName": "VizAI",
    "commonName": "VizAI",
    "primaryDomain": "vizai.io"
  }
}
